{
  "version": 1,
  "category": "常识判断",
  "title": "国考常识判断题库",
  "questionCount": 60,
  "materials": [],
  "questions": [
    {
      "id": "common-sense-001",
      "category": "常识判断",
      "subtype": "法律-宪法",
      "difficulty": "easy",
      "stem": "根据我国宪法，下列关于国家机构的说法正确的是：",
      "materialId": null,
      "options": [
        {
          "key": "A",
          "text": "中央军事委员会实行集体负责制"
        },
        {
          "key": "B",
          "text": "国务院是最高国家审判机关"
        },
        {
          "key": "C",
          "text": "国家监察委员会是最高国家检察机关"
        },
        {
          "key": "D",
          "text": "全国人民代表大会是最高国家权力机关"
        }
      ],
      "answer": "D",
      "explanation": "宪法第五十七条规定，全国人民代表大会是最高国家权力机关。国务院是最高国家行政机关，最高人民法院是最高审判机关，最高人民检察院是最高检察机关；中央军事委员会实行主席负责制。",
      "knowledgePoints": [
        "国家机构",
        "全国人民代表大会"
      ],
      "sourceRefs": [
        {
          "kind": "official",
          "title": "中华人民共和国宪法",
          "url": "https://www.gov.cn/guoqing/2018-03/22/content_5276318.htm"
        }
      ],
      "status": "reviewed"
    },
    {
      "id": "common-sense-002",
      "category": "常识判断",
      "subtype": "法律-民法",
      "difficulty": "easy",
      "stem": "甲在商场拾得乙遗失的钱包。根据民法典，甲应当如何处理？",
      "materialId": null,
      "options": [
        {
          "key": "A",
          "text": "取得钱包所有权"
        },
        {
          "key": "B",
          "text": "满三十日无人认领即可自行处分"
        },
        {
          "key": "C",
          "text": "扣除一半现金后返还"
        },
        {
          "key": "D",
          "text": "及时通知权利人领取或者送交有关部门"
        }
      ],
      "answer": "D",
      "explanation": "民法典第三百一十四条规定，拾得遗失物，应当返还权利人；拾得人应当及时通知权利人领取，或者送交公安等有关部门。拾得并不当然取得所有权，也无权自行扣留财物。",
      "knowledgePoints": [
        "遗失物",
        "物权"
      ],
      "sourceRefs": [
        {
          "kind": "official",
          "title": "中华人民共和国民法典",
          "url": "https://www.gov.cn/xinwen/2020-06/01/content_5516649.htm",
          "publishedAt": "2020-06-01",
          "accessedAt": "2026-06-18"
        }
      ],
      "status": "reviewed"
    },
    {
      "id": "common-sense-003",
      "category": "常识判断",
      "subtype": "法律-行政法",
      "difficulty": "medium",
      "stem": "某行政机关拟作出降低资质等级的行政处罚。关于当事人的程序权利，下列说法正确的是：",
      "materialId": null,
      "options": [
        {
          "key": "A",
          "text": "只能申请行政复议，不能要求听证"
        },
        {
          "key": "B",
          "text": "行政机关作出处罚后才需告知听证权"
        },
        {
          "key": "C",
          "text": "当事人要求听证的，行政机关应当组织听证"
        },
        {
          "key": "D",
          "text": "听证费用原则上由当事人承担"
        }
      ],
      "answer": "C",
      "explanation": "行政处罚法规定，行政机关拟作出降低资质等级等较重处罚时，应告知当事人有要求听证的权利；当事人要求听证的，行政机关应当组织，且当事人不承担行政机关组织听证的费用。",
      "knowledgePoints": [
        "行政处罚",
        "听证程序"
      ],
      "sourceRefs": [
        {
          "kind": "official",
          "title": "中华人民共和国行政处罚法",
          "url": "https://www.gov.cn/xinwen/2021-01/23/content_5582020.htm",
          "publishedAt": "2021-01-23",
          "accessedAt": "2026-06-18"
        }
      ],
      "status": "reviewed"
    },
    {
      "id": "common-sense-004",
      "category": "常识判断",
      "subtype": "法律-刑法",
      "difficulty": "medium",
      "stem": "甲为了实施盗窃而进入商场，因看到保安巡逻，认为无法得手而离开。甲停止犯罪的原因是：",
      "materialId": null,
      "options": [
        {
          "key": "A",
          "text": "自动放弃犯罪，属于犯罪中止"
        },
        {
          "key": "B",
          "text": "意志以外原因未得逞，属于犯罪未遂"
        },
        {
          "key": "C",
          "text": "尚未着手，当然不构成犯罪"
        },
        {
          "key": "D",
          "text": "犯罪目的消失，属于犯罪既遂"
        }
      ],
      "answer": "B",
      "explanation": "甲已经为盗窃进入具体作案场所并着手实行，因保安巡逻这一意志以外的障碍未能得逞，符合犯罪未遂。犯罪中止要求行为人自动放弃犯罪或自动有效防止结果发生。",
      "knowledgePoints": [
        "犯罪未遂",
        "犯罪中止"
      ],
      "sourceRefs": [
        {
          "kind": "official",
          "title": "中华人民共和国刑法",
          "url": "https://flk.npc.gov.cn/detail2.html?MmM5MDlmZGQ2NzhiZjE3OTAxNjc4YmY3YjMyNzAwNjQ%3D"
        }
      ],
      "status": "reviewed"
    },
    {
      "id": "common-sense-005",
      "category": "常识判断",
      "subtype": "法律-劳动法",
      "difficulty": "easy",
      "stem": "关于劳动合同试用期，下列说法符合劳动合同法的是：",
      "materialId": null,
      "options": [
        {
          "key": "A",
          "text": "同一用人单位与同一劳动者只能约定一次试用期"
        },
        {
          "key": "B",
          "text": "以完成一定工作任务为期限的劳动合同可约定试用期"
        },
        {
          "key": "C",
          "text": "试用期不包含在劳动合同期限内"
        },
        {
          "key": "D",
          "text": "仅约定试用期的，该期限届满后合同自动终止"
        }
      ],
      "answer": "A",
      "explanation": "劳动合同法第十九条规定，同一用人单位与同一劳动者只能约定一次试用期；以完成一定工作任务为期限或期限不满三个月的合同不得约定试用期；试用期包含在合同期限内，仅约定试用期的，试用期不成立，该期限为劳动合同期限。",
      "knowledgePoints": [
        "劳动合同",
        "试用期"
      ],
      "sourceRefs": [
        {
          "kind": "official",
          "title": "中华人民共和国劳动合同法",
          "url": "https://www.gov.cn/flfg/2007-06/29/content_669394.htm"
        }
      ],
      "status": "reviewed"
    },
    {
      "id": "common-sense-006",
      "category": "常识判断",
      "subtype": "法律-消费者权益保护",
      "difficulty": "medium",
      "stem": "经营者通过网络销售商品，消费者依法无理由退货时，下列处理正确的是：",
      "materialId": null,
      "options": [
        {
          "key": "A",
          "text": "所有网络销售商品均可七日无理由退货"
        },
        {
          "key": "B",
          "text": "消费者定作的商品通常不适用无理由退货"
        },
        {
          "key": "C",
          "text": "退货运费一律由经营者承担"
        },
        {
          "key": "D",
          "text": "消费者必须说明商品存在质量问题"
        }
      ],
      "answer": "B",
      "explanation": "消费者权益保护法规定，网络购物一般享有七日无理由退货，但消费者定作、鲜活易腐等商品除外。无理由退货无需证明质量问题，退回商品的运费通常由消费者承担，经营者另有约定的从其约定。",
      "knowledgePoints": [
        "网络购物",
        "七日无理由退货"
      ],
      "sourceRefs": [
        {
          "kind": "official",
          "title": "中华人民共和国消费者权益保护法",
          "url": "https://www.gov.cn/jrzg/2013-10/25/content_2515601.htm"
        }
      ],
      "status": "reviewed"
    },
    {
      "id": "common-sense-007",
      "category": "常识判断",
      "subtype": "法律-行政复议",
      "difficulty": "hard",
      "stem": "根据行政复议法，下列情形中，公民可以依法申请行政复议的是：",
      "materialId": null,
      "options": [
        {
          "key": "A",
          "text": "不服行政机关对其作出的警告处罚"
        },
        {
          "key": "B",
          "text": "不服人民法院作出的民事判决"
        },
        {
          "key": "C",
          "text": "不服行政机关工作人员的内部考核结果"
        },
        {
          "key": "D",
          "text": "不服仲裁委员会作出的商事仲裁裁决"
        }
      ],
      "answer": "A",
      "explanation": "行政处罚属于行政机关作出的行政行为，公民认为其侵犯合法权益的，可以申请行政复议。法院判决由诉讼程序救济，内部人事处理通常不属于行政复议受案范围，商事仲裁裁决也不是行政行为。",
      "knowledgePoints": [
        "行政复议范围",
        "行政行为"
      ],
      "sourceRefs": [
        {
          "kind": "official",
          "title": "中华人民共和国行政复议法",
          "url": "https://www.gov.cn/yaowen/liebiao/202309/content_6903485.htm",
          "publishedAt": "2023-09-01",
          "accessedAt": "2026-06-18"
        }
      ],
      "status": "reviewed"
    },
    {
      "id": "common-sense-008",
      "category": "常识判断",
      "subtype": "法律-民事诉讼",
      "difficulty": "medium",
      "stem": "在民事诉讼中，关于举证责任的一般规则，下列表述正确的是：",
      "materialId": null,
      "options": [
        {
          "key": "A",
          "text": "所有事实均由法院主动调查，当事人无须举证"
        },
        {
          "key": "B",
          "text": "当事人对自己提出的主张，有责任提供证据"
        },
        {
          "key": "C",
          "text": "原告永远承担全部举证责任"
        },
        {
          "key": "D",
          "text": "被告否认原告主张即无须提供任何证据"
        }
      ],
      "answer": "B",
      "explanation": "民事诉讼法确立“谁主张、谁举证”的一般规则，即当事人对自己提出的主张有责任及时提供证据。具体案件可能依法适用举证责任倒置或由法院调查收集特定证据，但不改变该一般原则。",
      "knowledgePoints": [
        "举证责任",
        "民事诉讼"
      ],
      "sourceRefs": [
        {
          "kind": "official",
          "title": "中华人民共和国民事诉讼法",
          "url": "https://flk.npc.gov.cn/detail2.html?ZmY4MDgxODE3OTZhNjM2YjAxNzk4MjJhMTk0ZDIwN2E%3D"
        }
      ],
      "status": "reviewed"
    },
    {
      "id": "common-sense-009",
      "category": "常识判断",
      "subtype": "法律-个人信息保护",
      "difficulty": "medium",
      "stem": "某应用程序收集实现基本功能并非必要的精确定位信息。根据个人信息保护法，下列做法正确的是：",
      "materialId": null,
      "options": [
        {
          "key": "A",
          "text": "拒绝提供定位信息即可拒绝全部服务"
        },
        {
          "key": "B",
          "text": "只要写入隐私政策便可无限期保存"
        },
        {
          "key": "C",
          "text": "应有明确合理目的，并限于实现处理目的的最小范围"
        },
        {
          "key": "D",
          "text": "个人信息经收集后不再属于个人权益范围"
        }
      ],
      "answer": "C",
      "explanation": "个人信息处理应具有明确、合理的目的，与处理目的直接相关，并采取对个人权益影响最小的方式，收集限于最小范围。非基本功能所必需的信息被拒绝提供时，处理者不得因此拒绝提供基本服务。",
      "knowledgePoints": [
        "个人信息处理原则",
        "最小必要"
      ],
      "sourceRefs": [
        {
          "kind": "official",
          "title": "中华人民共和国个人信息保护法",
          "url": "https://www.gov.cn/xinwen/2021-08/20/content_5632486.htm",
          "publishedAt": "2021-08-20",
          "accessedAt": "2026-06-18"
        }
      ],
      "status": "reviewed"
    },
    {
      "id": "common-sense-010",
      "category": "常识判断",
      "subtype": "法律-著作权",
      "difficulty": "easy",
      "stem": "下列对象中，依法最可能受到著作权法保护的是：",
      "materialId": null,
      "options": [
        {
          "key": "A",
          "text": "一条单纯的数学公式"
        },
        {
          "key": "B",
          "text": "国家机关发布的法律文本"
        },
        {
          "key": "C",
          "text": "作者独立创作并具有独创性的小说"
        },
        {
          "key": "D",
          "text": "通用数表"
        }
      ],
      "answer": "C",
      "explanation": "著作权法保护文学、艺术和科学领域内具有独创性并能以一定形式表现的智力成果。小说符合这一条件；法律法规、单纯事实消息、历法、通用数表及公式等依法不适用著作权法保护。",
      "knowledgePoints": [
        "著作权客体",
        "作品独创性"
      ],
      "sourceRefs": [
        {
          "kind": "official",
          "title": "中华人民共和国著作权法",